<?xml version="1.0" encoding="UTF-8"?>
<!--<!DOCTYPE curriculum SYSTEM "10.dtd">-->
<pedido xmlns:xsi="http://www.w3.org/2001/XMLSchema-instance" xsi:noNamespaceSchemaLocation="10.xsd">
    <!--entrante, primero, segundo y postre-->
    <!--todos los nombre tienen un tamaÃ±o maximo de 100 caracteres y min de 4-->
    <!--todos los platos empiezan por mayuscula-->
    <plato tipo="entrante">
        <nombre tipo="jamon">Croquetas caseras</nombre><!--jamon, boletus o mixtas-->
        <cantidad tipo="racion">media</cantidad>
        <sinGluten opcion="false"/>
        <precio>3.20</precio>
    </plato>
    <plato tipo="primero">
        <nombre>Macarrones a la carbonara</nombre>
        <sinGluten opcion="false"/>
        <precio>4.80</precio>
    </plato>
    <plato tipo="segundo">
        <nombre>Pollo al ajillo</nombre>
        <sinGluten opcion="true"/>
        <precio>4.80</precio>
    </plato>
    <plato tipo="postre">
        <nombre tipo="dulce">Coullant de chocolate caliente y nata</nombre>
        <precio>6</precio>
    </plato>
    <bebida>
        <nombre tipo="sin gas" medida="ml" tamanyo="500">Agua</nombre>
        <precio>1.20</precio>
    </bebida>
    <bebida>
        <nombre tipo="sin gas" medida="ml" tamanyo="1000">Agua</nombre>
        <precio>1.20</precio>
    </bebida>
    <bebida>
        <nombre tipo="con gas" medida="ml" tamanyo="250">Fanta</nombre>
        <precio>1.20</precio>
    </bebida>
    <formaPago><!--bizzum, visa, efectivo, criptomoneda-->
        <bizzum>50</bizzum>
    </formaPago>
</pedido>